,id,name,address,city,state,zip,county,phone,type,ownership,emergency,quality,LAT,LON
0,20000,CASP -Centro de Apoio Social do Pisão,,Sintra,Lisboa,2710-631,,,,,No,,38.7419088,-9.4237165
1,20001,CLIRIA - CLÍNICA DE OIÃ,,Oliveira do Bairro,Aveiro,3770-059,,,,,,,40.5428801,-8.5379597
2,20002,CUF Torres Vedras,,Torres Vedras,Lisboa,2560-270,,,,,,,39.0803026,-9.2589595
3,20003,CVP - Unidade de Cuidados Continuados,,Vila Viçosa,Évora,7160-266,,,,,No,,38.7698022,-7.4129523
4,20004,Casa de Saúde S. Mateus Hospital,,Viseu,Viseu,3510-105,,,,,Yes,,40.6568619,-7.905244
5,20005,Casa de Saúde da Boavista,,Porto,Porto,4250-266,,,,,,,41.1644544,-8.633827
6,20006,Casa de Saúde da Idanha,,Sintra,Lisboa,2605-072,,,,,No,,38.7740856,-9.2784262
7,20007,Casa de Saúde do Montepio Rainha Dona Leonor,Rua Montepio Rainha Dona Leonor nan,Caldas da Rainha,Leiria,2500-241,,,,,Yes,,39.4065049,-9.134645
8,20008,Casa de saúde S. João de Deus,,Barcelos,Braga,4750-128,,,,,,,41.5410266,-8.6211019
9,20009,"Centro Hospitalar Barreiro-Montijo, EPE",,Barreiro,Setúbal,2830-302,,,,,Yes,,38.6563814,-9.0593613
10,20010,Centro Hospitalar S. Francisco,,Leiria,Leiria,2400-186,,,,,,,39.7487557,-8.8161326
11,20011,Centro Hospitalar Tondela-Viseu (Psiquiatria),,Viseu,Viseu,3515-150,,,,,,,40.6811605,-7.919192
12,20012,"Centro Hospitalar Universitário da Cova da Beira, EPE",,Covilhã,Castelo Branco,6200-151,,,,,Yes,,40.2657612,-7.493502
13,20013,Centro Hospitalar Vila Nova de Gaia/Espinho Santos Silva - Unidade 1,,Vila Nova de Gaia,Porto,4400-095,,,,,,,41.1070602,-8.5958785
14,20014,Centro Hospitalar de Nossa Senhora da Conceição,Rua Principal 26,Batalha,Leiria,2440-090,,+351 244 769 430,,,No,,39.6390773,-8.8174944
15,20015,"Centro Hospitalar de Setúbal, EPE",,Setúbal,Setúbal,2900,,,,,Yes,,38.5285461,-8.8810689
16,20016,"Centro Hospitalar de Setúbal, EPE- Hospital Ortopédio Santiago d'Outão",,Setúbal,Setúbal,2925,,,,,,,38.4879822,-8.9358787
17,20017,Centro Hospitalar de Vila Nova de Gaia/Espinho,Rua 37 nan,Espinho,Aveiro,4500-255,,,,,,,41.0024921,-8.6371172
18,20018,Centro Hospitalar e Universitário do Algarve-Hospital de Faro,,Faro,Faro,8000-269,,,,,Yes,,37.0257025,-7.9302568
19,20019,Centro Materno-Infantil do Norte,Largo da Maternidade de Júlio Dinis nan,Porto,Porto,4150-601,,+351 222 077 500,,,,,41.1506092,-8.6234138
20,20020,Centro Médico,,Sintra,Lisboa,2710-631,,,,,No,,38.7515398,-9.3925944
21,20021,Centro Médico Internacional do Guadiana,,Vila Real de Santo António,Faro,8900-203,,,,,No,,37.1878757,-7.4191227
22,20022,Centro Médico Privado de Estarreja,,Estarreja,Aveiro,3860-362,,,,,,,40.7546691,-8.5690623
23,20023,Centro Médico de Gondomar,Praça Manuel Guedes 245,Gondomar,Porto,4420-356,,,,,,,41.1444153,-8.5367072
24,20024,Centro Médico dos Moutidos,,Maia,Porto,4425-139,,,,,,,41.2115299,-8.5724526
25,20025,Centro Saúde Ribeirão,,Vila Nova de Famalicão,Braga,4760-715,,,,,,,41.3580956,-8.5603793
26,20026,Centro Saúde da Maia,,Maia,Porto,4470-151,,,,,,,41.2333858,-8.6261504
27,20027,Centro Saúde de Santa Marta de Portuzelo,,Viana do Castelo,Viana Do Castelo,4925-104,,,,,,,41.7088676,-8.772509
28,20028,Centro Saúde de Viseu III,,Viseu,Viseu,3510-105,,,,,,,40.6446396,-7.9137767
29,20029,Centro de Atendimento Permanente Cinfães (Hospital),,Cinfães,Viseu,4690-040,,,,,Yes,,41.074446,-8.0910552
30,20030,Centro de Medicina de Reabilitação de Alcoitão,,Cascais,Lisboa,2645-066,,,,,No,,38.7342798,-9.4030812
31,20031,Centro de Reabilitação do Norte,Avenida Infante de Sagres 349,Vila Nova de Gaia,Porto,4405,,,,,No,,41.0902993,-8.6562546
32,20032,Centro de Saude,,Lousada,Porto,4620-009,,,,,,,41.2804533,-8.2780487
33,20033,Centro de Saude,,Ponte de Lima,Viana Do Castelo,4990-445,,,,,,,41.6567843,-8.585216
34,20034,Centro de Saude Camacha,,,,,,,,,,,32.6794793,-16.844064
35,20035,Centro de Saude de Arronches,,Arronches,Portalegre,7340-004,,,,,,,39.1233553,-7.2809712
36,20036,Centro de Saude do Cartaxo,,Cartaxo,Santarém,2070-116,,,,,No,,39.1655198,-8.7844574
37,20037,Centro de Saúde,,São João da Pesqueira,Viseu,5130-321,,,,,,,41.1454737,-7.4013958
38,20038,Centro de Saúde,,Vila Real,Vila Real,5000-471,,,,,,,41.3021596,-7.7404685
39,20039,Centro de Saúde,,Mourão,Évora,7240-237,,,,,No,,38.385435,-7.3409756
40,20040,Centro de Saúde,,Nelas,Viseu,3525-064,,,,,No,,40.503842,-7.8983827
41,20041,Centro de Saúde,,Castelo de Paiva,Aveiro,4550-110,,,,,No,,41.0401845,-8.2673709
42,20042,Centro de Saúde,,Celorico da Beira,Guarda,6360-350,,,,,,,40.629851,-7.3975222
43,20043,Centro de Saúde,,Amarante,Porto,4600-088,,,,,,,41.2716385,-8.0789946
44,20044,Centro de Saúde,,Seixal,Setúbal,2840-400,,,,,,,38.6184104,-9.0976313
45,20045,Centro de Saúde,,Olhão,Faro,8700-221,,,,,No,,37.0360147,-7.8404725
46,20046,Centro de Saúde,,Miranda do Douro,Bragança,5210-188,,,,,No,,41.4956414,-6.2772463
47,20047,Centro de Saúde,,Viana do Castelo,Viana Do Castelo,4905-311,,,,,No,,41.6484789,-8.7014073
48,20048,Centro de Saúde,,Paços de Ferreira,Porto,4590-579,,,,,,,41.2770598,-8.3773116
49,20049,Centro de Saúde,Rua do Doutor José de Sousa nan,Peso da Régua,Vila Real,5050-226,,,,,,,41.1665075,-7.7886325
50,20050,Centro de Saúde,,Torres Vedras,Lisboa,2560-127,,,,,No,,39.0899996,-9.3193359
51,20051,Centro de Saúde,,Santarém,Santarém,2005-256,,,,,No,,39.2380844,-8.7009409
52,20052,Centro de Saúde,,Vila Pouca de Aguiar,Vila Real,5450-011,,,,,,,41.4989481,-7.6445133
53,20053,Centro de Saúde,,São João da Madeira,Aveiro,3700-008,,,,,No,,40.8951804,-8.496412
54,20054,Centro de Saúde,,,,,,,,,,,38.7289513,-27.065701
55,20055,Centro de Saúde,,Arruda dos Vinhos,Lisboa,2630-288,,,,,,,38.9817047,-9.0818805
56,20056,Centro de Saúde,,Lousã,Coimbra,3200-206,,,,,,,40.1242919,-8.2349624
57,20057,Centro de Saúde,Avenida 1º de Maio nan,Almada,Setúbal,2825-279,,21 291 85 10,,,,,38.6449465,-9.2370388
58,20058,Centro de Saúde,,Vila Flor,Bragança,5360-360,,,,,,,41.3095109,-7.1575504
59,20059,Centro de Saúde,Rua Carlos Mendes Gonçalves nan,Golegã,Santarém,2150-198,,249 979 180,,,,,39.4028206,-8.4793029
60,20060,Centro de Saúde,,Castro Daire,Viseu,3600,,,,,,,40.8991222,-7.9275857
61,20061,Centro de Saúde,Rua 1 de Maio 2,Manteigas,Guarda,6260-101,,,,,No,,40.4935425,-7.6030399
62,20062,Centro de Saúde,Rua 1 de Maio 2,Manteigas,Guarda,6260-101,,,,,,,40.4175099,-7.7095415
63,20063,Centro de Saúde,,Lagos,Faro,8600-645,,,,,,,37.1017261,-8.6887854
64,20064,Centro de Saúde,,Marvão,Portalegre,7330,,,,,,,39.414209,-7.4563728
65,20065,Centro de Saúde,,Vieira do Minho,Braga,4850-538,,,,,No,,41.6353499,-8.1396253
66,20066,Centro de Saúde - Alferrarede,,Abrantes,Santarém,2200-299,,,,,,,39.4742868,-8.1913379
67,20067,Centro de Saúde - Extensão de Jugueiros,,Felgueiras,Porto,4610-362,,,,,No,,41.3962709,-8.2012969
68,20068,Centro de Saúde - Extensão de Lavos,,Figueira da Foz,Coimbra,3090-461,,233946381,,,,,40.0914966,-8.8298147
69,20069,Centro de Saúde Darque,,Viana do Castelo,Viana Do Castelo,4935-114,,,,,No,,41.6784894,-8.7997295
70,20070,Centro de Saúde Doutor Corte Real,Avenida da Liberdade 121,Aguiar da Beira,Guarda,3570-017,,,,,,,40.8094917,-7.5472763
71,20071,Centro de Saúde Quarteira,,Loulé,Faro,8125-181,,,,,,,37.0711229,-8.0928145
72,20072,Centro de Saúde São Pedro da Cova,R. da Associação Desportiva de São Pedro da Cova nan,Gondomar,Porto,4510-260,,,,,,,41.1602572,-8.5080127
73,20073,Centro de Saúde da Amorosa,,Guimarães,Braga,4800-158,,,,,,,41.4472663,-8.3027821
74,20074,Centro de Saúde da Boa Nova,,Vila Nova de Gaia,Porto,4405-742,,,,,No,,41.0948849,-8.6204879
75,20075,Centro de Saúde da Figueira da Foz,,Figueira da Foz,Coimbra,3080-016,,,,,,,40.1558441,-8.8541564
76,20076,Centro de Saúde da Gafanha da Nazaré,,Ílhavo,Aveiro,3830-554,,,,,,,40.6355804,-8.7120291
77,20077,Centro de Saúde da Lagoa,,,,,,,,,,,37.7478313,-25.5773545
78,20078,Centro de Saúde da Madalena,,,,,,,,,,,38.5308728,-28.5238778
79,20079,Centro de Saúde da Mealhada,,Mealhada,Aveiro,3050-375,,,,,No,,40.3801291,-8.4562682
80,20080,Centro de Saúde da Moita,,Moita,Setúbal,2860-487,,,,,,,38.6482642,-8.9927929
81,20081,Centro de Saúde da Quinta do Conde,,Sesimbra,Setúbal,2975,,,,,,,38.557713,-9.0472821
82,20082,Centro de Saúde de Aguim,,Anadia,Aveiro,3780-632,,,,,,,40.4132109,-8.448118
83,20083,Centro de Saúde de Albergaria-a-Velha,,Albergaria-a-Velha,Aveiro,3850-065,,,,,,,40.6861759,-8.4818358
84,20084,Centro de Saúde de Alenquer,Rua Francisco José Lopes s/n,Alenquer,Lisboa,2580-335,,+351263731340,,,No,,39.0506209,-8.9987112
85,20085,Centro de Saúde de Alfarelos,Praça de Luís de Camões nan,Soure,Coimbra,3130-001,,,,,,,40.149944,-8.6510938
86,20086,Centro de Saúde de Alte,,Loulé,Faro,8100-012,,,,,,,37.2359995,-8.1774154
87,20087,Centro de Saúde de Amares,,Amares,Braga,4720-349,,,,,No,,41.6303396,-8.358863
88,20088,Centro de Saúde de Anadia,,Anadia,Aveiro,3780-213,,,,,No,,40.4351608,-8.4407012
89,20089,Centro de Saúde de Angra do Heroísmo,Canada dos Melancólicos 2,,,,,+351 295 402900,,,No,,38.661527,-27.2125129
90,20090,Centro de Saúde de Aradas,,Aveiro,Aveiro,3810-417,,,,,,,40.6057862,-8.6362436
91,20091,Centro de Saúde de Arcena e Bom Sucesso,,Vila Franca de Xira,Lisboa,2615,,,,,,,38.9063482,-9.0461591
92,20092,Centro de Saúde de Arouca,,Arouca,Aveiro,4540-102,,,,,,,40.930386,-8.2548963
93,20093,Centro de Saúde de Azambuja,,Azambuja,Lisboa,2050-002,,,,,,,39.0685519,-8.8729904
94,20094,Centro de Saúde de Baião,,Baião,Porto,4640-147,,,,,,,41.1600095,-8.0380182
95,20095,Centro de Saúde de Barcelinhos,,Barcelos,Braga,4755,,,,,No,,41.5214628,-8.6178809
96,20096,Centro de Saúde de Bodiosa,,Viseu,Viseu,3515-553,,,,,No,,40.7171426,-7.992641
97,20097,Centro de Saúde de Boliqueime,,Loulé,Faro,8100-070,,,,,,,37.1320052,-8.1545845
98,20098,Centro de Saúde de Cantanhede,,Cantanhede,Coimbra,3060-201,,,,,,,40.3414743,-8.5876475
99,20099,Centro de Saúde de Castro Verde,,Castro Verde,Beja,7780-163,,,,,,,37.7026173,-8.0841288
100,20100,Centro de Saúde de Celorico de Basto,,Celorico de Basto,Braga,4890-220,,,,,No,,41.3845813,-8.0007891
101,20101,Centro de Saúde de Cristelo,,Paredes,Porto,4580-352,,,,,,,41.2275798,-8.3627933
102,20102,Centro de Saúde de Eixo,,Aveiro,Aveiro,3800-810,,,,,,,40.6282835,-8.5690923
103,20103,Centro de Saúde de Ermesinde,Rua da Bela 735,Valongo,Porto,4445-673,,+351 229 698 520,,,,,41.2265562,-8.545743
104,20104,Centro de Saúde de Estarreja,,Estarreja,Aveiro,3860-362,,,,,,,40.760451,-8.5743475
105,20105,Centro de Saúde de Febres,,Cantanhede,Coimbra,3060-318,,,,,,,40.4012183,-8.6298927
106,20106,Centro de Saúde de Fornos de Algodres,,Fornos de Algodres,Guarda,6370-148,,,,,,,40.6207884,-7.5360859
107,20107,Centro de Saúde de Lamego,,Lamego,Viseu,5100-065,,,,,,,41.100281,-7.8115156
108,20108,Centro de Saúde de Leça da Palmeira,,Matosinhos,Porto,4450-663,,,,,,,41.1990996,-8.6976763
109,20109,Centro de Saúde de Loulé,,Loulé,Faro,8100-663,,,,,,,37.146239,-8.0130823
110,20110,Centro de Saúde de Maceira,,Leiria,Leiria,2405-028,,,,,,,39.6842149,-8.888439
111,20111,Centro de Saúde de Murtosa,,Murtosa,Aveiro,3870-211,,,,,,,40.7474419,-8.6486649
112,20112,Centro de Saúde de Nordeste,Estrada Regional 7F,,,,,+351 296 480090,,,,,37.8345778,-25.1463295
113,20113,Centro de Saúde de Oeiras,,Oeiras,Lisboa,2780-213,,,,,No,,38.6935407,-9.3179834
114,20114,Centro de Saúde de Oliveira do Bairro,,Oliveira do Bairro,Aveiro,3770-211,,,,,,,40.517015,-8.4934998
115,20115,Centro de Saúde de Oliveirinha,,Aveiro,Aveiro,3810-861,,,,,,,40.6010842,-8.6049641
116,20116,Centro de Saúde de Ouca,,Vagos,Aveiro,3840-301,,,,,,,40.5230315,-8.6343379
117,20117,Centro de Saúde de Palmela,,Palmela,Setúbal,2950-216,,,,,,,38.5707076,-8.8971716
118,20118,Centro de Saúde de Paço de Sousa,,Penafiel,Porto,4560-375,,,,,,,41.1666828,-8.3536051
119,20119,Centro de Saúde de Penacova,,Penacova,Coimbra,3360-184,,,,,,,40.2671828,-8.2837721
120,20120,Centro de Saúde de Ponta Delgada,,,,,,,,,,,37.7534457,-25.676164
121,20121,Centro de Saúde de Portimão,,Portimão,Faro,8500-734,,,,,,,37.1385093,-8.5444341
122,20122,Centro de Saúde de Reguengos de Monsaraz,Rua Doutor Jacinto Fernandes Palma nan,Reguengos de Monsaraz,Évora,7200-363,,,,,,,38.4290857,-7.5399391
123,20123,Centro de Saúde de Resende,,Resende,Viseu,4660-220,,,,,,,41.1053801,-7.9680962
124,20124,Centro de Saúde de Ribeira de Pena,,Ribeira de Pena,Vila Real,4870,,,,,,,41.5185643,-7.7952635
125,20125,Centro de Saúde de Santa Cruz,,,,,,,,,,,32.6893179,-16.7941839
126,20126,Centro de Saúde de Santa Joana,,Aveiro,Aveiro,3810-239,,,,,No,,40.632228,-8.6187422
127,20127,Centro de Saúde de Sernancelhe,,Sernancelhe,Viseu,3640-211,,,,,,,40.898098,-7.4902535
128,20128,Centro de Saúde de Sever do Vouga,,Sever do Vouga,Aveiro,3740-255,,,,,,,40.7268763,-8.3641931
129,20129,Centro de Saúde de Sobreira,Rua Ernesto Silva 67,Paredes,Porto,4585,,,,,,,41.1537917,-8.3971193
130,20130,Centro de Saúde de Sosa,,Vagos,Aveiro,3840-351,,,,,,,40.5429183,-8.6465863
131,20131,Centro de Saúde de Soure,,Soure,Coimbra,3130-250,,,,,,,40.0627092,-8.6208654
132,20132,Centro de Saúde de São Roque do Pico,Avenida António Simas da Costa nan,,,,,+351 292 648070,,,,,38.52972,-28.3334036
133,20133,Centro de Saúde de Tarouca,,Tarouca,Viseu,3610-130,,,,,,,41.0222062,-7.7763963
134,20134,Centro de Saúde de Tavira,Estrada de Santa Luzia nan,Olhão,Faro,8700,,,,,No,,37.1155956,-7.6510442
135,20135,Centro de Saúde de Tondela,Av. 25 de Abril 102,Tondela,Viseu,3460-575,,,,,,,40.5174347,-8.0842348
136,20136,Centro de Saúde de Urgezes,,Guimarães,Braga,4810-491,,,,,,,41.4269987,-8.2940403
137,20137,Centro de Saúde de Urqueira,Rua do Rossio 1,Ourém,Santarém,2435-715,,,,,No,,39.7308666,-8.5958998
138,20138,Centro de Saúde de Vagos,,Vagos,Aveiro,3840-409,,,,,No,,40.5467844,-8.6857249
139,20139,Centro de Saúde de Valongo,,Valongo,Porto,4440-520,,,,,No,,41.1867701,-8.497584
140,20140,Centro de Saúde de Valpaços,,Valpaços,Vila Real,5430-442,,,,,,,41.6089345,-7.3136341
141,20141,Centro de Saúde de Vila Nova de Paiva,,Vila Nova de Paiva,Viseu,3650-209,,,,,No,,40.8498254,-7.7276651
142,20142,Centro de Saúde de Vila do Conde,,Vila do Conde,Porto,4480-671,,,,,,,41.3555271,-8.7453052
143,20143,Centro de Saúde de Vizela,,Vizela,Braga,4815-552,,,,,No,,41.3792618,-8.3144794
144,20144,Centro de Saúde de Vouzela,Rua Doutor Ribeiro Cardoso nan,Vouzela,Viseu,3670-249,,,,,No,,40.7221737,-8.1141859
145,20145,Centro de Saúde de Águeda,,Águeda,Aveiro,3750-166,,,,,,,40.5823497,-8.4469657
146,20146,Centro de Saúde do Afonsoeiro,Rua Doutor Francisco Manuel de Melo 71,Montijo,Setúbal,2870-235,,+351 212 309 870,,,No,,38.7032175,-8.955023
147,20147,Centro de Saúde do Montijo,Avenida Luís de Camões 21,Montijo,Setúbal,2870-235,,,,,No,,38.7084913,-8.9793709
148,20148,Centro de Saúde- Extensão de Gulpilhares,,Vila Nova de Gaia,Porto,4405-702,,,,,,,41.0769362,-8.6285801
149,20149,Centro de Sáude de São tomé de Negrelos,,Santo Tirso,Porto,4780-365,,,,,No,,41.3553327,-8.4090919
150,20150,Centro de saúde de Ourém,,Ourém,Santarém,2490,,,,,No,,39.6591157,-8.5757357
151,20151,Centro de saúde de Vale de Cambra,,Vale de Cambra,Aveiro,3730-240,,,,,,,40.8474462,-8.3932409
152,20152,Centro saúde de Borba,,Borba,Évora,7150-162,,,,,,,38.8045259,-7.4636781
153,20153,Clifala,Rua de São João de Deus 251,Gondomar,Porto,4420-356,,,,,,,41.1393767,-8.5292853
154,20154,Clinica CUF Belém,,Lisboa,Lisboa,1050-115,,,,,No,,38.6998067,-9.1824696
155,20155,Clinica Eco-Radiologica do Cartaxo,Rua do Progresso 3A,Cartaxo,Santarém,2070-116,,,,,No,,39.1654366,-8.7820057
156,20156,Clinica Santo Antonio,,Paços de Ferreira,Porto,4590-579,,,,,,,41.309613,-8.3682347
157,20157,Clinica de Modivas,,Vila do Conde,Porto,4485-585,,,,,No,,41.2947879,-8.6907743
158,20158,Clipóvoa,Avenida Manuel José Lebrão nan,Vila Nova de Cerveira,Viana Do Castelo,4920,,+351 251 706 101,,,No,,41.9412801,-8.7387999
159,20159,"Clitrofa – Centro Médico, Dentário e Cirúrgico",Avenida de Paradela 626,Trofa,Porto,4785-273,,,,,,,41.3331964,-8.549805
160,20160,Clínica Europa,,Cascais,Lisboa,2775-595,,,,,No,,38.6823964,-9.3414447
161,20161,Clínica Médico-Dentária Calouste Gulbenkian,,Cascais,Lisboa,2765-588,,,,,,,38.704583,-9.3946998
162,20162,Clínica Raríssimas da Moita,,Moita,Setúbal,2860-487,,,,,,,38.6491566,-8.9840159
163,20163,Clínica São João de Ávila,,Lisboa,Lisboa,1050-115,,,,,,,38.7515248,-9.1689598
164,20164,Clínica VizelMédica,,Vizela,Braga,4815-552,,,,,No,,41.3821914,-8.3157245
165,20165,Clínica de Diálise,,Óbidos,Leiria,2510-702,,,,,No,,39.362507,-9.1212486
166,20166,Clínica de Medicina Dentária Doutora Sílvia Silva,,Celorico de Basto,Braga,4890-322,,,,,,,41.3709391,-8.092774
167,20167,Clínica do Tempo - Doutor Humberto Barbosa,Avenida Marginal 3710,Cascais,Lisboa,2775-239,,+351 21 458 85 00,,,No,,38.6903325,-9.3630445
168,20168,Cruz Vermelha,,Olhão,Faro,8700-221,,,,,,,37.0353079,-7.8384091
169,20169,Cruz Vermelha,Rua da Cruz Vermelha 128,Terras de Bouro,Braga,4840-100,,253 351 444,,,Yes,,41.7182673,-8.3112948
170,20170,Cruz Vermelha Portuguesa,,Amarante,Porto,4600-088,,,,,,,41.2740792,-8.076743
171,20171,Cruz Vermelha Portuguesa,Avenida 31 de Janeiro 317,Braga,Braga,4700-442,,+351 253 208870,,,Yes,,41.5484885,-8.4152241
172,20172,Cruz Vermelha Portuguesa,,Castro Verde,Beja,7780-163,,,,,,,37.6932297,-8.0835566
173,20173,Cruz Vermelha Portuguesa - Delegação Marinhas,Avenida São Sebastião 80,Esposende,Braga,4740-522,,+351 253 964 720,,,Yes,,41.5569857,-8.7830557
174,20174,Cruz Vermelha Portuguesa - Delegação de Neiva,,Viana do Castelo,Viana Do Castelo,4935-535,,,,,,,41.6285962,-8.7736628
175,20175,Cruz Vermelha Portuguesa - Delegação do Gerês,,Terras de Bouro,Braga,4845-065,,,,,Yes,,41.7215613,-8.1662765
176,20176,Cuidados Continuados,,Vizela,Braga,4815-552,,,,,,,41.3761686,-8.315006
177,20177,Cuidados continuados,,Vale de Cambra,Aveiro,3730-240,,,,,,,40.8480171,-8.3921183
178,20178,D. Manuel de Aguiar,,Leiria,Leiria,2400-186,,,,,,,39.7441342,-8.8052335
179,20179,Departamento Psiquiátrico (Saúde Mental),,Covilhã,Castelo Branco,6200-151,,,,,,,40.2668395,-7.493944
180,20180,Entrada Principal Ágora,,Braga,Braga,4710,,,,,Yes,,41.5675427,-8.3995399
181,20181,Espírito Santo,,Évora,Évora,7000-749,,,,,Yes,,38.5706931,-7.9022262
182,20182,Extensao de Saúde de Oiã,,Oliveira do Bairro,Aveiro,3770-054,,,,,,,40.5415056,-8.5494555
183,20183,Extensão UCSP Cabreiros/Sequeira - Pólo Cabreiros (CS Braga II - Maximinos),,Braga,Braga,4705,,,,,,,41.5317809,-8.4910028
184,20184,Extensão de Saude,,Albergaria-a-Velha,Aveiro,3850-361,,,,,,,40.6240506,-8.5009839
185,20185,Extensão de Saúde Benquerença (C. S. Penamacor),,Penamacor,Castelo Branco,6090,,,,,,,40.2248165,-7.2331485
186,20186,Extensão de Saúde Lanheses,,Viana do Castelo,Viana Do Castelo,4925-410,,,,,,,41.7381463,-8.6803714
187,20187,Extensão de Saúde Santa Catarina da Serra (CS Leiria - Doutor Gorjão Henriques),Rua do Jardim nan,Leiria,Leiria,2495-186,,+351 244741151,,,No,,39.6748294,-8.6857316
188,20188,Extensão de Saúde da Branca,,Albergaria-a-Velha,Aveiro,3850-577,,,,,,,40.7469726,-8.4862348
189,20189,Extensão de Saúde da Pampilhosa,,Mealhada,Aveiro,3050-439,,,,,,,40.3390914,-8.4306851
190,20190,Extensão de Saúde da Praia de Mira,,Mira,Coimbra,3070-794,,,,,,,40.4561652,-8.7986422
191,20191,Extensão de Saúde de Alvarenga,,Arouca,Aveiro,4540-044,,,,,,,40.9663068,-8.1554957
192,20192,Extensão de Saúde de Barra de Mira,,Mira,Coimbra,3070-702,,,,,,,40.4881112,-8.784156
193,20193,Extensão de Saúde de Bunheiro,,Murtosa,Aveiro,3870-034,,,,,,,40.7736733,-8.6439697
194,20194,Extensão de Saúde de Canelas,,Estarreja,Aveiro,3865-011,,,,,,,40.7175887,-8.5530082
195,20195,Extensão de Saúde de Caramulo,Largo do Caramulo nan,Tondela,Viseu,3475-031,,,,,,,40.5727468,-8.1730804
196,20196,Extensão de Saúde de Carapelhos,,Mira,Coimbra,3070-617,,,,,,,40.4357392,-8.6898732
197,20197,Extensão de Saúde de Castelo do Neiva,,Viana do Castelo,Viana Do Castelo,4935-574,,,,,,,41.621743,-8.7979938
198,20198,Extensão de Saúde de Chafé,,Viana do Castelo,Viana Do Castelo,4935-586,,,,,,,41.650099,-8.7803141
199,20199,Extensão de Saúde de Corticeiro de Cima,,Cantanhede,Coimbra,3060-752,,,,,,,40.4279253,-8.6790516
200,20200,Extensão de Saúde de Fermelã,,Estarreja,Aveiro,3865-127,,,,,,,40.701138,-8.5536972
201,20201,Extensão de Saúde de Luso,,,Aveiro,,,,,,,,40.3863131,-8.3788274
202,20202,Extensão de Saúde de Odeceixe,,,Aveiro,,,,,,No,,37.4245618,-8.7709942
203,20203,Extensão de Saúde de Palmaz,,Oliveira de Azeméis,Aveiro,3720-423,,,,,,,40.7981167,-8.4602993
204,20204,Extensão de Saúde de Pico de Regalados,,Vila Verde,Braga,4730-577,,,,,,,41.687229,-8.4242926
205,20205,Extensão de Saúde de Ponte de Vagos,,Vagos,Aveiro,3840-326,,,,,,,40.4767137,-8.6705354
206,20206,Extensão de Saúde de Ribeira de Fráguas,,Albergaria-a-Velha,Aveiro,3850-711,,,,,,,40.7414365,-8.4457772
207,20207,Extensão de Saúde de Rossas,,Vieira do Minho,Braga,4850-299,,,,,,,41.5672699,-8.1056247
208,20208,Extensão de Saúde de Salreu,,Estarreja,Aveiro,3865-284,,,,,,,40.7387758,-8.5577989
209,20209,Extensão de Saúde de Troviscal,,Oliveira do Bairro,Aveiro,3770-410,,,,,,,40.5025316,-8.5644644
210,20210,Extensão de Saúde de Valmaior,,Albergaria-a-Velha,Aveiro,3850-835,,,,,,,40.6993513,-8.4612922
211,20211,Extensão de Saúde de Veiros,,Estarreja,Aveiro,3860-601,,,,,,,40.7509997,-8.6123236
212,20212,Extensão de Saúde de Vilarinho do Bairro,,Anadia,Aveiro,3780-599,,,,,,,40.4219812,-8.5213172
213,20213,Extensão de Sáude de Armação de Pêra,,Silves,Faro,8365-138,,,,,,,37.1058077,-8.3577446
214,20214,Fundação Dona Anna de Sommer Champalimaud e Doutor Carlos Montez Champalimaud,,Lisboa,Lisboa,1050-115,,,,,,,38.6941246,-9.2221133
215,20215,HPP Hospital de Albufeira,,Albufeira,Faro,8200-112,,,,,,,37.1030725,-8.2327871
216,20216,HPP Hospital de Cascais Doutor José de Almeida,Avenida Brigadeiro Victor Novais Gonçalves nan,Cascais,Lisboa,2750-411,,,,,Yes,,38.7282727,-9.4175607
217,20217,Hospitais Senhor do Bonfim,,Vila do Conde,Porto,4480-565,,,,,Yes,,41.3875224,-8.7144325
218,20218,Hospitais da Universidade de Coimbra - Bloco Central,Praceta Professor Mota Pinto nan,Coimbra,Coimbra,3000-250,,+351 239 400 400,,,,,40.2195676,-8.411283
219,20219,Hospitais da Universidade de Coimbra - Blocos de Celas,,Coimbra,Coimbra,3000-075,,,,,,,40.2191991,-8.4097328
220,20220,Hospital Amato Lusitano,,Castelo Branco,Castelo Branco,6000,,,,,Yes,,39.8234183,-7.4986418
221,20221,Hospital António Lopes,,Póvoa de Lanhoso,Braga,4830-518,,,,,No,,41.5736346,-8.2659417
222,20222,Hospital Beatriz Ângelo,Avenida Carlos Teixeira 3,Loures,Lisboa,2670-380,,,,,Yes,,38.8206633,-9.1743424
223,20223,Hospital Bernardino Lopes de Oliveira,,Alcobaça,Leiria,2460-018,,,,,Yes,,39.5502927,-8.9728878
224,20224,Hospital CUF Infante Santo,Travessa do Castro 3,Lisboa,Lisboa,1050-115,,+351213926100,,,,,38.7049314,-9.1685359
225,20225,Hospital CUF Viseu,Rua Belo Horizonte 12 e 14,Viseu,Viseu,3500-606,,,,,Yes,,40.6441531,-7.911925
226,20226,Hospital Cirúgico de Setúbal,,Setúbal,Setúbal,2900,,,,,No,,38.5380333,-8.8703919
227,20227,Hospital Cuf Descobertas,,Lisboa,Lisboa,1050-115,,,,,Yes,,38.7587821,-9.0998048
228,20228,Hospital Curry Cabral,Rua da Beneficência 6-8,Lisboa,Lisboa,1050-115,,,,,,,38.7391536,-9.1531513
229,20229,Hospital Distrital da Figueira da Foz,,Figueira da Foz,Coimbra,3080-016,,,,,Yes,,40.1311067,-8.8623405
230,20230,Hospital Distrital de Abrantes,,Abrantes,Santarém,2200-299,,,,,Yes,,39.4558286,-8.199556
231,20231,Hospital Distrital de Bragança,Avenida Abade de Baçal nan,Bragança,Bragança,5300-379,,+351 273 310 800,,,Yes,,41.8041437,-6.7687339
232,20232,Hospital Distrital de Pombal,,Pombal,Leiria,3100-428,,,,,Yes,,39.916806,-8.625616
233,20233,Hospital Distrital de São João da Madeira,,São João da Madeira,Aveiro,3700-008,,,,,Yes,,40.8939709,-8.4946345
234,20234,Hospital Distrital do Montijo,Rua Machado Santos 54,Montijo,Setúbal,2870-235,,,,,Yes,,38.7079281,-8.9705603
235,20235,Hospital Dom Luís I,,Peso da Régua,Vila Real,5050-226,,,,,Yes,,41.1657241,-7.792951
236,20236,Hospital Dona Estefânia,Rua Jacinta Marto nan,Lisboa,Lisboa,1050-115,,,,,,,38.7276257,-9.1393819
237,20237,Hospital Doutor Aprigio Meireles,,Idanha-a-Nova,Castelo Branco,6060-179,,,,,,,39.9247577,-7.2407601
238,20238,Hospital Doutor Francisco Zagalo,Avenida Doutor Nunes da Silva nan,Ovar,Aveiro,3880-213,,+351 256579200,,,No,,40.8579273,-8.6321659
239,20239,Hospital Doutor José Maria Grande,,Portalegre,Portalegre,7300-065,,,,,,,39.2996744,-7.4293006
240,20240,Hospital Fernando Fonseca - Amadora/Sintra,,Amadora,Lisboa,2700-337,,,,,Yes,,38.7428458,-9.2494992
241,20241,"Hospital Garcia de Orta, EPE",,Almada,Setúbal,2805,,,,,Yes,,38.6721507,-9.1753997
242,20242,Hospital Geral de Santo António,Largo do Prof. Abel Salazar nan,Porto,Porto,4050-501,,,,,Yes,,41.1464262,-8.6178884
243,20243,Hospital Infante Dom Pedro,,Aveiro,Aveiro,3810-169,,,,,Yes,,40.6357527,-8.6547205
244,20244,Hospital Joaquim Urbano,,Porto,Porto,4300-066,,,,,,,41.1546824,-8.5937306
245,20245,Hospital José Joaquim Fernandes,Rua Doutor António Fernando Covas Lima nan,Beja,Beja,7800,,,,,Yes,,38.0142979,-7.8713918
246,20246,Hospital José Luciano de Castro,,Anadia,Aveiro,3780-213,,,,,No,,40.4427544,-8.4417217
247,20247,Hospital Lusíadas Porto,,Porto,Porto,4150-090,,,,,,,41.1573133,-8.6262594
248,20248,Hospital Maria Pia,,Porto,Porto,4050-175,,,,,,,41.1568191,-8.6228366
249,20249,Hospital Militar Regional nº 1 (Dom Pedro V),Avenida da Boavista nan,Porto,Porto,4150-090,,+351 226 087 900,,,,,41.1576791,-8.6269358
250,20250,Hospital Narciso Ferreira,,Vila Nova de Famalicão,Braga,4765-220,,+351 252900800,,,,,41.3908807,-8.3905284
251,20251,Hospital Nossa Senhora da Arrábida,,Setúbal,Setúbal,2925-256,,,,,No,,38.5454893,-9.0288509
